{
  "configurationDeliveryVersion": "2",
  "status": "releaseCandidate",
  "releaseSchema": "../../schema/configuration-delivery/v2/release.schema.json",
  "capabilityRequestSchema": "../../schema/configuration-delivery/v2/capability-request.schema.json",
  "canonicalFixture": "../../fixtures/configuration-delivery/v2/advanced-release.json",
  "releaseEnvironmentModes": [
    "development",
    "staging",
    "production"
  ],
  "supportedPlacementDecisionContracts": [
    "1"
  ],
  "supportedPaywallProtocols": [
    "0.2"
  ],
  "readerPolicy": {
    "unknownDeliveryVersion": "rejectRelease",
    "unsupportedDecisionContract": "rejectRelease",
    "unsupportedDecisionFeature": "rejectRelease",
    "unsupportedBucketingAlgorithm": "rejectRelease",
    "invalidReference": "rejectRelease",
    "invalidDigest": "rejectRelease",
    "candidateRejected": "keepLastAcceptedRelease",
    "noAcceptedRelease": "loadBundledRelease",
    "bundledReleaseRejected": "configurationUnavailable",
    "partialAcceptance": "forbidden",
    "legacyProjection": "explicitDefaultPaywallOnly"
  }
}
